ID,PageTopic,Year,Month,Title,Author,Content,Link
1,General Politics,2024,11,Ex-CNN boss rips media 'hyperbole' on Trump: Their 'end of democracy' claims will lead to 'credibility' crisis,Joseph A. Wulfsohn,"'Outnumbered' panelists discuss the media's outrage over Vice President Harris' election loss. Former CNN boss Chris Licht took a swipe at the ""hyperbole"" from the legacy media leading up to last week's historic victory of President-elect Donald Trump.  Speaking at the Yahoo Finance Invest conference Tuesday, Licht was asked how the media can regain trust as the country embraces a second Trump administration.  His advice to his media colleagues: ""Swing at the pitches that are thrown."" ""To completely butcher a Chris Rock phrase, if someone kills eight people, don't say they killed nine,"" Licht said. ""[Trump's] going to do enough things that really require scrutiny and sounding the alarm bells. Don't say, 'Well, this means this, and that means that's going to happen.' Say he did this, and then let's discuss what that means. Not, ‘Well this is going to mean this’ because a lot of times the media gets in trouble when they predict things.""  CNN STAFFERS ‘DEEPLY FRUSTRATED’ AS LOOMING BUDGET CUTS, LAYOFFS SET TO IMPACT STRUGGLING NETWORK Ex-CNN chairman Chris Licht slammed the ""hyperbole"" coming from the legacy media about a second Trump presidency. (Kevin Mazur/Getty Images) Licht, who was ousted as CNN's chairman and CEO in June 2023 after barely over a year on the job, pointed to the ""hyperbole"" he had seen as a media observer regarding what a second Trump presidency would bring. ""'It's the end of democracy.' Well, if it's not, if four years from now it's not, then we have a problem with credibility,"" Licht said. ""So instead, 'He's appointed this person, this is this person's track record,' not 'that means he's going to do this,' right?"" CHRIS WALLACE OUT AT CNN AFTER 3 YEARS AT THE NETWORK ""There will be enough to discuss. There will be enough things that are going to be controversial. But he and his people know exactly what they're doing when they try to gin up what one of my former colleagues called outrage porn. If everything is an 11, and everything is outrageous, then you're able to kind of slip through some things that actually should create that outrage,"" he added.  Licht said the media will have a ""credibility"" problem if democracy is still around after President-elect Trump's second term.  (Chip Somodevilla/Getty Images) Licht was handpicked by Warner Bros. Discovery chief David Zaslav in 2022 to help revive CNN's viewership and restore its journalistic credibility after the network spent years building a reputation for being an anti-Trump news organization under predecessor Jeff Zucker.  CNN's rank-and-file resisted Licht's efforts to remove the spectacle from its coverage. Among his major moves were dismissing prominent liberal on-air figures, including Brian Stelter, Don Lemon and Jeffrey Toobin. However, Licht had completely lost the trust of CNN staff after the network hosted the now-infamous Trump town hall in May 2023, which sparked unprecedented fury from within the newsroom. Licht was fired by Zaslav weeks later.  MEDIA RECKONING: WHERE ARE THE PRO-TRUMP DISSENTING VOICES AT LIBERAL NEWS ORGANIZATIONS? Fast-forward to November 2024 as financial woes and dismal viewership continue to plague the network. Many of Licht's decisions were reversed – Stelter was rehired as a media analyst, and Toobin and Lemon have made multiple appearances as guests – and CNN's anti-Trump coverage came back in a roaring fashion through Election Day.  CNN has been plagued with dwindling viewership in recent years. ( Elijah Nouvelage/Bloomberg via Getty Images) CLICK HERE TO GET THE FOX NEWS APP  CNN's current honcho Mark Thompson is now tasked with stopping the bleeding of its dwindling audience and its bottom line. CNN staffers have told Fox News Digital they're ""deeply frustrated"" as significant budget cuts and layoffs are likely to rock the network in the coming months.  Joseph A. Wulfsohn is a media reporter for Fox News Digital. Story tips can be sent to joseph.wulfsohn@fox.com and on Twitter: @JosephWulfsohn. ",https://www.foxnews.com/media/ex-cnn-boss-rips-media-hyperbole-trump-end-democracy-claims-lead-credibility-crisis
2,General Politics,2024,11,Trump expected to 'soon' appoint a Ukrainian peace envoy after promises of negotiating end to war with Russia,Morgan Phillips,"Former special ops intel analyst Brett Velicovich on how the people in Ukraine are reacting to Trump's election victory and the need for change from how the Biden administration EXCLUSIVE: President-elect Donald Trump is expected to soon appoint a Ukrainian peace envoy to lead negotiations on ending the war with Russia, multiple sources told Fox News Digital.  ""You’re going to see a very senior special envoy, someone with a lot of credibility, who will be given a task to find a resolution, to get to a peace settlement,"" one of the sources said.  ""You’re going to see that in short order.""  The job is not expected to be a salaried role - from 2017 to 2019, Kurt Volker had served as special representative to Ukrainian negotiations on a volunteer basis.  TRUMP'S FIRST CABINET PICKS DECIDEDLY NOT ISOLATIONISTS: UKRAINE, ISRAEL BREATHE A SIGH OF RELIEF Trump has been rolling out appointee names at lightning pace of those he wants to fill his Cabinet and advise him on top issues.   Trump is expected to soon appoint a Ukrainian peace envoy to lead negotiations on ending the war with Russia, multiple sources told Fox News Digital (AP/Evan Vucci) He picked Rep. Michael Waltz, R-Fla., to serve as his national security advisor and sources have told Fox News he’s settled on Sen. Marco Rubio, R-Fla., to lead the State Department.  Trump has designated Steven Witkoff to be his special envoy to the Middle East.  Trump has long insisted he could negotiate an end to the war with Ukrainian President Volodymyr Zelensky and Russian President Vladimir Putin. Few details have been given about how he would do this.  A report last week by the Wall Street Journal suggested Vice President-elect Vance’s controversial suggestions from the campaign trail are now being pushed by multiple advisers close to the president-elect. A woman stands in the backyard of her house destroyed by a Russian air strike, amid Russia's attack on Ukraine, in Zaporizhzhia, Ukraine October 10, 2024. REUTERS/Stringer TRUMP TEAM REACTS TO REPORT PRESIDENT-ELECT TOLD RUSSIA'S PUTIN NOT TO ESCALATE WAR WITH UKRAINE Some advisers are reportedly encouraging Trump to push Kyiv to agree to terms that would freeze the frontlines by creating an 800-mile-long demilitarized zone and allow Russia to keep the land it has illegally seized, which amounts to roughly 20% of Ukraine. It has also been suggested that Kyiv should agree not to pursue NATO membership for 20 years, a stipulation that critics of this plan argue kowtows to Russian President Vladimir Putin. CLICK HERE TO GET THE FOX NEWS APP A Washington Post report on Sunday also claimed Trump had spoken with Putin, where the president-elect told the Russian leader not to escalate the war. Trump's transition team would not confirm or deny the call.  Fox News' Caitlin McFall contributed to this report.  ",https://www.foxnews.com/politics/trump-appoint-ukrainian-peace-envoypromises-negotiating-end-war-russia
3,General Politics,2024,11,Republicans to huddle behind closed doors to elect McConnell's successor Wednesday,Julia Johnson,"Fox News senior congressional correspondent Chad Pergram reports on the Republican Senate leadership battle. The incoming Senate Republican Conference will meet to hold secret ballot elections for several leadership positions on Wednesday morning, including the successor of Senate Minority Leader Mitch McConnell, R-Ky., who will lead the Republican majority next year. At 9:30 a.m., the conference for the 119th Congress will select a new leader, Republican whip, conference chair, Republican policy committee chair, vice conference chair and National Republican Senatorial Committee (NRS) chair. Those vying for the coveted leader role are Senate Minority Whip John Thune, R-S.D., and Sens. John Cornyn, R-Texas, and Rick Scott, R-Fla.  Senators John Cornyn, John Thune and Rick Scott are being speculated as contenders in the race to succeed Mitch McConnell as leader. (Getty Images) On Tuesday, 42 GOP senators gathered for a leader candidate forum led by Sen. Mike Lee, R-Utah. Several of the lawmakers expressed satisfaction with how the discussion went, and Scott ended the evening by adding two additional endorsements.  According to Lee, the Republicans discussed a range of issues, some procedural, some substantive, and some policy-oriented.  President-elect Donald Trump notably has not made an endorsement in the Senate leader race. Scott's race, however, has gained the support of high-profile Trump allies like Robert F. Kennedy, Jr. and X owner Elon Musk. TRUMP ALLIES BACK RICK SCOTT IN GOP SENATE LEADER RACE AS THEY LOOK TO INFLUENCE SECRET BALLOT Senate Republican conference Chairman John Barrasso, R-Wyo., is running unopposed for whip, while Sen. James Lankford, R-Okla., is running unopposed for vice conference chair. Sen. Shelley Moore Capito, R-W.Va., is unopposed in her bid for Republican policy committee chair and Sen. Tim Scott, R-S.C., is running unopposed for NRSC chair. Sens. Joni Ernst, R-Iowa, and Tom Cotton, R-Ark., will face off for the No. 3 GOP role of conference chair. The Wednesday morning elections will take place in the old Senate chamber in the Capitol. Before each race, each candidate will have two nominating speeches from other senators. Then they'll make their own case. There may be some discussion before senators vote, and the secret ballot will remain private unless individual senators decide to disclose who they chose. Even then, there is no way to verify. SCHUMER WON'T ALLOW DAVE MCCORMICK AT SENATE ORIENTATION, CITING OUTSTANDING PA BALLOTS Senate Minority Leader Mitch McConnell, a Republican from Kentucky, speaks during a news conference at the US Capitol in Washington, DC, on Wednesday, Nov. 6, 2024 (Al Drago/Bloomberg via Getty Images) The elections could last for hours, with the 2022 elections lasting until 1 p.m. after Scott challenged McConnell in the leader race. CLICK HERE TO GET THE FOX NEWS APP In order to be elected, a candidate must receive a majority vote from the 53-member conference. This means they must garner 27 votes. Senators will not assume the new roles until the new Congress begins in January. Julia Johnson is a politics writer for Fox News Digital and Fox Business, leading coverage of the U.S. Senate. She was previously a politics reporter at the Washington Examiner.  Follow Julia's reporting on X at @JuliaaJohnson_ and send tips to Julia.Johnson@fox.com. ",https://www.foxnews.com/politics/republicans-huddle-behind-close-doors-elect-mcconnells-successor-wednesday
4,General Politics,2024,11,Trump's picks so far: Here's who will be advising the new president,Morgan Phillips,"Former Deputy Assistant Defense Secretary Elbridge Colby discusses what to expect in the Middle East under President-elect Trump on ‘The Story.’ Since winning the election last week, President-elect Donald Trump has begun evaluating and rolling out his picks for his Cabinet and other top roles.  Here’s a roundup of whom Trump has picked to fill top jobs in his administration:  Wiles has been widely lauded for heading Trump’s successful campaign this year, having run Trump’s campaign operations in Florida in 2016 and 2020. She maintained close ties with the president-elect throughout the Biden administration and signed on as CEO of Trump’s Save America PAC in 2021.  ""Susie is tough, smart, innovative and is universally admired and respected. Susie will continue to work tirelessly to Make America Great Again. It is a well deserved honor to have Susie as the first-ever female Chief of Staff in United States history. I have no doubt that she will make our country proud,"" Trump said in a statement.  Trump picked campaign manager Susie Wiles for his chief of staff. (AP Photo/Alex Brandon) THESE ARE THE TOP NAMES IN CONTENTION FOR DEFENSE SECRETARY UNDER TRUMP Elise Stefanik, the New York Republican representative and current House GOP Conference Chair has been an attack dog for Trump in Congress.  She is a staunch supporter of Israel, having made headlines for her combative lines of questioning of Ivy League university presidents over their handling of anti-Israel protests, some of which prompted the presidents to resign. President-elect Trump picked Elise Stefanik to be the next ambassador to the United Nations. (ANGELA WEISS/AFP via Getty Images) On Tuesday, Trump announced the Florida Republican representative and former Army Green Beret would be his national security adviser. He’s decidedly a hawk on China and Iran.  ""Mike retired as a Colonel, and is a nationally recognized leader in National Security, a bestselling author, and an expert on the threats posed by China, Russia, Iran, and global terrorism,"" Trump said in a statement.  ""Mike has been a strong champion of my America First Foreign Policy agenda, and will be a tremendous champion of our pursuit of Peace through Strength!"" On Tuesday, Trump announced Rep. Michael Waltz, a Florida Republican and former Army Green Beret, would be his national security adviser. He’s decidedly a hawk on China and Iran. (John Nacion/Getty Images) Homan, the former acting director of U.S. Immigration and Customs Enforcement, was an architect of Trump's zero-tolerance policy during his first administration, one that led to backlash from family separations at the border.  Homan has served under six administrations and presidents in both parties, dating back to the Reagan era, as a rank-and-file Border Patrol agent. He was appointed to the position of executive associate director of enforcement and removal operations for ICE under President Obama. While serving at a ""czar"" level rather than in an official Cabinet position, Homan will be in charge of ""the Southern Border, the Northern Border, all Maritime, and Aviation Security,"" Trump announced on Truth Social.  ""I’ve known Tom for a long time, and there is nobody better at policing and controlling our Borders,"" Trump wrote. ""Likewise, Tom Homan will be in charge of all Deportation of Illegal Aliens back to their Country of Origin. Congratulations to Tom. I have no doubt he will do a fantastic, and long awaited for, job."" Tom Homan was tapped by President-elect Donald Trump to be his ""border czar."" (Bill Clark/CQ-Roll Call, Inc via Getty Images) Huckabee, the former governor of Arkansas, is a staunch supporter of Israel, prompted by his evangelical faith.  ""Mike has been a great public servant, Governor, and Leader in Faith for many years. He loves Israel, and the people of Israel, and likewise, the people of Israel love him"", a statement attached to Trump’s Truth Social post said. ""Mike will work tirelessly to bring about Peace in the Middle East!"" Former Arkansas Gov. Mike Huckabee will be Trump's ambassador to Israel. (Chip Somodevilla/Getty Images) Zeldin, a former House Republican from New York, had a notably strong, but unsuccessful, showing in the race for governor against Kathy Hochul in 2022.  During that race, he called for New York to lift its ban on fracking. He also lost his House race for re-election in 2022 but has maintained ties with the Trump team. Lee Zeldin will lead the EPA will lead the EPA. (Lev Radin/Pacific Press/LightRocket via Getty Images) Witkoff, a real estate investor, landlord, and the founder of the Witkoff Group, was tapped as Trump's Middle East enjoy. He campaign with Trump during the campaign. In his announcement, Trump said that Witkoff would be an ""unrelenting Voice for PEACE"" in the highly-contentious region. Steve Witkoff, founder and chief executive officer of Witkoff Group LLC, speaks during a campaign event with former US President Donald Trump, not pictured, at Madison Square Garden in New York, US, on Sunday, Oct. 27, 2024.  (Adam Gray/Bloomberg via Getty Images) McGinley, who served in Trump's first presidential term as White House cabinet secretary, returns to the White House for Trump's second term. The White House Counsel conducts key behind-the-scene research into potential Supreme Court nominees. William J. McGinley speaks at an event hosted by BNA on new lobbying laws. (Tom Williams/Roll Call/Getty Images) Ratcliffe previously served under Trump during his first term as Director of National Intelligence (DNI). He will head the Central Intelligence Agency (CIA).  In 2020, he was awarded the National Security Medal, the nation’s highest honor for distinguished achievement in the field of intelligence and national security.  John Ratcliffe is President-elect Trump's pick to lead the CIA. (Getty Images) Billionaire Elon Musk and former GOP presidential candidate Vivek Ramaswamy were tapped to lead the Department of Government Efficiency. Trump said that the pair will work together to ""dismantle Government Bureaucracy, slash excess regulations, cut wasteful expenditures, and restructure Federal Agencies."" ""It will become, potentially, ‘The Manhattan Project’ of our time,"" the announcement on Tuesday evening said. ""Republican politicians have dreamed about the objectives of ‘DOGE’ for a very long time."" Vivek Ramaswamy and Elon Musk have been tapped by President-elect Donald Trump to lead the Department of Government Efficiency. (Getty Images/AP Images) Trump nominated Hegseth to lead the Department of Defense. He would need to be confirmed by the Senate to assume the position. Hegseth has long championed a strong military and veterans causes.  He served in Iraq and Afghanistan as an Army infantry officer, being awarded two Bronze Stars and the Combat Infantryman's Badge. Hegseth was a host on ""FOX & Friends Weekend"" and FOX Nation until his last day on Tuesday.  ""Nobody fights harder for the Troops, and Pete will be a courageous and patriotic champion of our ‘Peace through Strength’ policy,"" Trump said.  Pete Hegseth has been tapped by Trump to be his secretary of defense.  (Roy Rochlin/Getty Images) Trump announced on Tuesday that South Dakota Governor Kristi Noem is his pick for secretary of the Department of Homeland Security. Noem would need to be approved by the Senate to assume the position. DHS oversees U.S. Customs and Border Protection, Immigration and Customs Enforcement, the U.S. Secret Service and the Federal Emergency Management Agency.   ""She was the first Governor to send National Guard Soldiers to help Texas fight the Biden Border Crisis, and they were sent a total of eight times,"" the Trump transition team said in a statement on Tuesday. ""She will work closely with ‘Border Czar’ Tom Homan to secure the Border, and will guarantee that our American Homeland is secure from our adversaries."" Gov. Kristi Noem, R-N.D., speaking during the first day of the Republican National Convention, Monday, July 15, 2024, in Milwaukee.  (AP Photo/J. Scott Applewhite) GOP REP. MIKE WALTZ TAPPED TO BE TRUMP'S NATIONAL SECURITY ADVISER Trump announced that his longtime aide Dan Scavino Jr. will return to the White House as an assistant to the president and deputy chief of staff.  ""Scavino was a Trump Campaign Senior Advisor and remains one of President Trump's longest serving and most trusted aides,"" the Trump transition team said.  Former White House deputy chief of staff Dan Scavino arrives at the Republican National Convention Monday, July 15, 2024, in Milwaukee.  (AP Photo/Paul Sancya) Trump announced Stephen Miller will serve as deputy chief of staff for policy in his administration. Miller was a senior adviser in Trump’s first term. He helped craft many of Trump’s hard-line speeches and plans on immigration.  Since Trump left office, Miller has served as the president of America First Legal, an organization of former Trump advisers fashioned as a conservative version of the American Civil Liberties Union, challenging the Biden administration, media companies, universities and others over issues such as freedom of speech and religion and national security. Miller has advocated for mass deportations during a second Trump term.  Stephen Miller, former Senior Advisor to U.S. President Donald Trump speaks at a campaign rally for Republican presidential nominee, former U.S. President Donald Trump, on October 18, 2024, in Detroit, Michigan. There are 17 days remaining until the U.S. presidential election, which will take place on Tuesday, November 5, 2024. (Win McNamee/Getty Images) Trump announced James Blair will serve in the White House as an assistant to the president and deputy chief of staff for legislative, political and public affairs.  ""Blair was the Trump Campaign and Republican National Committee Political Director, managing hundreds of staff and overseeing a wide portfolio of political operations and programs,"" the Trump transition team said.  Blair was in charge of the Trump campaign's get-out-the-vote operations in key battleground states, which Trump swept on Election Day.  Trump announced that Taylor Budowich will join him in the White House as an assistant to the president and deputy chief of staff for communications and personnel.  ""Prior to joining the Trump Campaign, Budowich served in a senior role in President Trump’s Leadership PAC, Save America, and as CEO of the pro-Trump Super PAC, MAGA Inc.,"" the Trump transition team said.  ""Dan, Stephen, James, and Taylor were 'best in class' advisors on my winning campaign, and I know they will honorably serve the American people in the White House,"" Trump said in a statement announcing his senior campaign aides would be promoted to the White House. ""They will continue to work hard to Make America Great Again in their respective new roles."" Taylor Budowich, a former spokesman for former President Donald Trump and founder of MxM News app.  (Twitter) Sources tell Fox News Trump has settled on Rubio, another Iran and China hawk, to run the State Department. Rubio, a Republican from Florida and top GOP member of the Senate Intelligence Committee, ran for president in 2016 when he and Trump traded barbs, with Trump calling him ""little Marco.""  Sen. Marco Rubio, R-Fla., attends a campaign rally for former President Donald Trump at the Trump National Doral Golf Club on July 9, 2024 in Doral, Fla. (Joe Raedle/Getty Images) CLICK HERE TO GET THE FOX NEWS APP It’s all seemingly water under the bridge now. Rubio was reportedly on a short list for VP picks earlier this year.  ",https://www.foxnews.com/politics/trumps-picks-so-far-heres-who-advising-new-president
5,General Politics,2024,11,Democratic committee chair pours cold water on replacing Sotomayor before Trump takes office,Greg Norman,"Sen. Bernie Sanders responded to calls for 70-year-old Supreme Court Justice Sotomayor to step down and open up space for a younger candidate. Talk of Supreme Court Justice Sonia Sotomayor retiring and having her seat filled before President-elect Donald Trump takes office is ""idle speculation"" and not ""realistic,"" a top Democrat says.  Senate Judiciary Chair Dick Durbin, D-Ill., made the comments to Politico following reports that Democrats are discussing whether to call on the 70-year-old to vacate her seat to avoid potentially giving Trump the opportunity to replace her if she retires following his return to the White House in January.  ""Whoever makes those calls [for a retirement] can't count,"" Durbin told Politico. ""Take a look at the calendar and tell me how in the world you could achieve that without setting aside the budget and the defense authorization act and all the other things that need to be done? I don't think it's a realistic idea.""  Last week, a Democratic senator also said to Politico: ""She can sort of resign conditionally on someone being appointed to replace her. But she can’t resign conditioned on a specific person. What happens if she resigns and the nominee to replace her isn’t confirmed, and the next president fills the vacancy?""  SOTOMAYOR SHOULD BE REPLACED BY KAMALA HARRIS, CNN COMMENTATOR ARGUES  Sen. Dick Durbin, left, is casting doubt on talk of Supreme Court Justice Sonia Sotomayor, right, being replaced before Trump takes office again. (David Paul Morris/Bloomberg via Getty Images/Alex Wong/Getty Images) Sotomayor is one of the three justices on the Supreme Court appointed by a Democratic president.  Democrats lost their Senate majority to Republicans in the 2024 election and only have about two months left of control in the chamber.  JUSTICE ALITO PLANS TO REMAIN ON SUPREME COURT, RESISTING PRESSURE TO STEP ASIDE: REPORT  Sonia Sotomayor is one of three Supreme Court Justices appointed by a Democratic president. (Pablo Cuadra) People close to Sotomayor recently told The Wall Street Journal that she has no plans to step aside from her position.   Democrats reportedly are concerned that President-elect Donald Trump could potentially appoint another conservative-leaning Supreme Court justice. (AP/Evan Vucci) CLICK HERE TO GET THE FOX NEWS APP ""This is no time to lose her important voice on the court. She just turned 70 and takes better care of herself than anyone I know,"" one source told the newspaper.  Fox News’ Aubrie Spady contributed to this report.  Greg Norman is a reporter at Fox News Digital. ",https://www.foxnews.com/politics/democratic-committee-chair-pours-cold-water-replacing-sotomayor-before-trump-takes-office
