ID,PageTopic,Year,Month,Title,Author,Content,Link
20,General Politics,2024,11,"OpenAI touts AI infrastructure ‘blueprint’ to outcompete China, bolster economy under incoming Trump admin",Nikolas Lanum,"Kurt 'CyberGuy' Knutsson on President-elect Trump's plan to deregulate cryptocurrency and A.I. in his second administration. OpenAI has assembled a ""blueprint"" for artificial intelligence (AI) infrastructure that the company hopes will be considered by the incoming Trump administration and Congress – suggesting that the plan will help the United States maintain its lead in the field over competitors like China. The company’s Vice President of Global Affairs, Chris Lehane, announced the ""Infrastructure Blueprint for the U.S."" on Wednesday during an event hosted by the Center for Strategic and International Studies (CSIS).  The company says AI's potential presents an ""unmissable opportunity to revitalize the American Dream and reindustrialize the US."" ""Investments to extend the current U.S. lead in AI will yield tens of thousands of skilled-trade and other jobs, growth in productivity and GDP; a modernized grid including power generated by nuclear energy; a state-of-the-art network of semiconductor manufacturing facilities; and a new generation of AI-powered businesses and entrepreneurship,"" OpenAI claims. PETITION CALLS FOR TRUMP ADMIN TO APPOINT MUSK AS AI ADVISER In this photo illustration, the OpenAI logo is seen displayed on a mobile phone screen with ChatGPT logo in the background. (Idrees Abbas/SOPA Images/LightRocket via Getty Images) The company, led by Sam Altman, also estimates that U.S.-backed projects abroad will help attract $175 billion currently sitting in global funds. They purport that these potential investments are a beneficial alternative to China-backed projects—characterizing the East Asian country's endeavors as a means to limit citizen access to AI, tighten government control over the populace and strengthen global influence. ""We need a national strategy now to ensure that investment in AI infrastructure benefits and protects American competitiveness, our national security and that of our allies,"" the company said in its blueprint release. ""This strategy should encourage rather than stifle developers, who will be the Main Street businesses of the Intelligence Age. It should support thriving AI ecosystems of labs, start-ups and larger companies that together will secure America's leadership role on AI into the future.""  OpenAI listed a set of five initiatives to catalyze the building of AI infrastructure in the U.S. and with allies across the world. 1) AI economic zones: The company is urging state and federal governments to give states incentives that speed up the permitting and approval of AI infrastructure –thereby making it easier to complete new solar arrays, wind farms and bring nuclear reactors back online. OpenAI said states providing subsidies could include a clause that ensures a portion of the compute is made available to public universities. HOW A RESEARCHER HACKED CHATGPT'S MEMORY TO EXPOSE A MAJOR SECURITY FLAW Sam Altman, chief executive officer of OpenAI, speaks during a panel session on day three of the World Economic Forum (WEF) in Davos, Switzerland, on Thursday, January 18, 2024. (Stefan Wermuth/Bloomberg via Getty Images / Getty Images) 2) National Transmission Highway Act: OpenAI is pushing for a program that would give funding to stand-up transmission infrastructure for AI, including electrical power on an AI-optimized transmission grid, high-bandwidth data communications, and pipelines for other energy sources needed to power a nationwide ""AI highway."" 3) Government backstops for high-value AI public works: Open AI believes the U.S. government can encourage the private sector to fund high-cost energy infrastructure projects. The government would then commit to purchasing energy and other means that lower credit risk. Furthermore, the government could direct funding to local training programs that prepare Americans for AI jobs, such as data center management and operations. OpenAI says existing state-sponsored 529 educational savings accounts 
could also be altered to allow investments in coding boot camps, HVAC technician training and electrical training. 4) A North American Compact for AI: The company suggests a pact among countries in the Western Hemisphere to streamline access to capital, supply chains and talent. They believe that eventually, as it expands, the sharing of resources and information could easily compete with the People's Republic of China's AI infrastructure alliances. AI-POWERED ATTACK DRONES TAKE FLIGHT 5) Tapping the expertise of the US nuclear Navy: OpenAI is pushing the government to utilize the Navy, which operates approximately 100 Small Modular Reactors (SMRs) to power naval submarines. In their blueprint, the Navy could offer their expertise to construct civilian SMR's and ""catalyze a revival of the American nuclear power that helps drive our great reindustrialization."" ""AI presents an unmissable opportunity to reindustrialize the U.S. and, through that, generate the kind of broad-based economic growth that will revitalize the American Dream. It also presents a national security imperative to protect our nation and our allies against a surging China by offering an AI shaped by democratic values, promoting individual choice and benefiting the most people possible,"" OpenAI said. OpenAI believes the incoming Trump administration should consider their ideas for the future of AI infrastructure.  (Getty Images) Leaders in both the House and Senate have emphasized that getting lawmakers up to speed on AI is a priority for Congress. However, they've diverged somewhat on what that means. Still, people close to the growing AI sector say they are frustrated with the pace Congress is handling the technology. In July, Congress passed a bipartisan act to mitigate financial and regulatory challenges impeding nuclear energy development. According to Pew, a majority of Americans favor an increase in nuclear plants to generate electricity. TRUMP'S FIRST CABINET PICKS DECIDEDLY NOT ISOLATIONISTS: UKRAINE, ISRAEL BREATHE A SIGN OF RELIEF Still, the shutdown of nuclear reactors continues to outpace new construction. President-elect Donald Trump took a skeptical stance on nuclear energy in his interview with podcaster Joe Rogan leading up to the election. ""There’s a little danger to nuclear,"" he said. ""You know, we had some really bad nuclear."" Trump took issue with two proposed reactor projects that crumbled under his administration. Still, he pointed to France as an example of how countries can invest in nuclear and make it efficient.  CLICK HERE TO GET THE FOX NEWS APP ""France does it. France is largely nuclear,"" Trump said. ""And they build small, little, compact plants, and if they build more, they build the same thing, and they hook it up."" Nikolas Lanum is an associate editor for Fox News Digital. ",https://www.foxnews.com/media/openai-touts-ai-infrastructure-blueprint-outcompete-china-bolster-economy-incoming-trump-admin
21,General Politics,2024,11,Fox News Politics: Transition Mission,Fox News Staff,"Welcome to the Fox News Politics newsletter, with the latest updates on the Trump transition, exclusive interviews and more Fox News politics content. Here's what's happening… -What to know about Trump's pick to oversee deportations -House majority hinges on 18 uncalled races, with Republicans just 4 seats away -Stefanik to reportedly meet Israeli president after Trump names her next UN ambassador -Pennsylvania Republicans win first State Senate seat in Philadelphia in nearly 3 decades Thomas Homan, who President-elect Donald Trump appointed as ""border czar"" on Sunday night, has a clear message for any Democratic governors who oppose the planned mass deportation operation. ""If they're not willing to help, then get the hell out of the way because [Immigration and Customs Enforcement (ICE)] is going to do their job,"" Homan, who was acting ICE director during the first Trump administration, told Fox News Digital in an interview on Friday. Trump announced on Sunday that Homan will be appointed ""border czar"" and would be in charge of the borders and ""all Deportation of Illegal Aliens back to their country of origin"" in the new administration…Read more This split shows former acting ICE director Tom Homan and anti-ICE protesters ((Erik McGregor/LightRocket via Getty Images and ANDREW CABALLERO-REYNOLDS/AFP via Getty Images)) END THE ED: State education chief ‘on GOP radar’ launches gameplan for nixing cabinet department…Read more 'ADMINISTRATION'S PATTERN': State Department provides promotional advantages based on gender, report finds…Read more NEW LEADERSHIP: Trump taps former New York Congressman Lee Zeldin to lead EPA…Read more MILLER TIME: Vance congratulates Miller on new Trump administration position…Read more NEW YORK, NEW YORK - OCTOBER 27: Stephen Miller, Senior Advisor to Republican presidential nominee, former President Donald J. Trump and President, America First Legal speaks prior to Trump taking the stage at a campaign rally at Madison Square Garden on October 27, 2024 in New York City.  (Michael M. Santiago/Getty Images) 'HE WILL DELIVER': Trump to install 'energy czar' to dismantle Biden climate rules: report…Read more COME TOGETHER: Biden, Harris to appear together for first time since Election Day at Veterans Day ceremony…Read more STICKING WITH SENATE: Eric Schmitt withdraws from Trump attorney general consideration to remain in Senate…Read more 'MORALLY BANKRUPT': What Stefanik's House tenure reveals about what type of UN ambassador she may be…Read more RACE IS ON: Trump allies back Rick Scott in GOP Senate leader race as they look to influence secret ballot…Read more PERSONAL 'ESCORT': GOP senator offers to 'personally escort' McCormick to Senate orientation after Schumer hold…Read more McCormick accused Casey of lying about him and slammed the Democrat for failing to stop fentanyl trafficking over the border. (Getty Images) DON'T GO THERE: Joe Rogan reveals Harris team wanted ‘restrictions’ on potential interview…Read more FIRST PEEK AT 2028: Here are the Democrats who may eventually run for president in 2028…Read more 'AFRAID OF FIGHTS': Blue state Democrats issue scathing reflection on election loss: 'We're out of touch'…Read more Democrat Rep. Pat Ryan, left, & Democrat Senator Chris Murphy, right.  (Getty) CONFERENCE CHAIR: Rep Lisa McClain announces run for GOP conference chair after Stefanik tapped for UN ambassador…Read more 'THROUGH THE ROOF': Border Patrol agents' morale soars after Trump’s re-election…Read more 'DISGUSTING': Pro-Palestine protesters plan anti-Veterans Day gathering at Columbia University…Read more FIGHTING 'HATE AND LIES': Israeli official praises Stefanik as UN pick, says her 'moral clarity' will combat body's 'hate and lies'…Read more Newly appointed US Ambassador to the United Nations Elise Stefanik, left, and Israeli President Isaac Herzog, right (Getty) TAIWAN: Would the US defend Taiwan under Trump if China invades? Fox News investigates…Read more FLYING HAZARDS: Spirit Airlines flight from Florida hit by gunfire while trying to land in Haiti…Read more Get the latest updates on the Trump presidential transition, incoming Congress, exclusive interviews and more on FoxNews.com. This article was written by Fox News staff. ",https://www.foxnews.com/politics/fox-news-politics-11-11
22,General Politics,2024,11,Fox News Politics: Administration of Allies,Fox News Staff,"Welcome to the Fox News Politics newsletter, with the latest updates on the Trump transition, exclusive interviews and more Fox News politics content. Here's what's happening… -House balance of power still undecided a week after Election Day, with Republicans needing 4 more seats -Trump likely to make several border security moves on first day, says expert -Trump confirms Mike Waltz as National Security Adviser pick President-elect Trump is quickly moving to assemble his second administration, and this time around, he does not appear to be searching for many outsiders to his political orbit. As he aims to turn Washington, D.C., upside down, the former and future president is turning to allies, loyalists and other supporters of his MAGA movement and America First agenda, many of whom are known commodities in the nation's capital. Unlike eight years ago, when the first-time politician first took control of the White House, he is not in the market for establishment types or those who served in his first administration, but in his mind, proved disloyal…Read more Former President Donald. Trump speaks to a rally crowd Sunday, Oct. 6, 2024, at the Dodge County Airport in Juneau, Wis.. (Jovanny Hernandez/Milwaukee Journal Sentinel / USA TODAY NETWORK via Imagn Images) 'VERY BIG MANDATE': Trump tells world leader election gives him a ‘very big mandate’…Read more COMING OUT OF RETIREMENT: Federal judge in Ohio rescinds retirement after Trump victory, with Biden yet to nominate a successor…Read more 'FUNDAMENTAL FLAWS': Biden supports bringing adversarial nations into new UN cyber crime alliance…Read more 'DECEPTIVE': Biden admin touts job well done replenishing oil reserves despite depleting them by half over last four years…Read more ‘$1 BILLION DISASTER’: Here's what FEC filings show about Harris campaign's 3 month spending spree…Read more TOPSHOT - US producer and actress Oprah Winfrey (L) holds up US Vice President and Democratic presidential candidate Kamala Harris' hand as she arrive onstage during a campaign rally on the Benjamin Franklin Parkway in Philadelphia, Pennsylvania, on November 4, 2024. (Photo by ANGELA WEISS / AFP) (Photo by ANGELA WEISS/AFP via Getty Images) (Getty Images) MOVIN ON UP: Who could replace Elise Stefanik in House GOP leadership? What we know…Read more TRUMP'S NEXT TOP COP: Who's who on Trump's short list for attorney general…Read more FORMER GOVERNOR GETS NOM: Trump nominates Mike Huckabee for US ambassador to Israel…Read more NOEM ON THE SHORTLIST: Trump expected to choose South Dakota Gov. Kristi Noem for Homeland Security secretary, source says…Read more South Dakota Governor Kristi Noem greets attendees as she speaks on Day 1 of the Republican National Convention (RNC) at the Fiserv Forum in Milwaukee, Wisconsin, U.S., July 15, 2024.  (REUTERS/Brian Snyder) MUSICAL CHAIRS: Tom Cotton likely to succeed Marco Rubio in top Intelligence Committee position…Read more 'FANTASTIC PICK': Ex-Trump official predicts ‘entire mindset change’ at southern border, hails ‘fantastic’ Noem pick for DHS…Read more 'STRONG CHOICE': Fetterman hails Rubio as 'strong choice' for secretary of state, says he will vote to confirm him…Read more LEADERSHIP JOCKEYING: These are the top names in contention for defense secretary under Trump…Read more CHANGE OF HEART: Schumer invites McCormick, Gallego to new-senator orientation…Read more THINNING THE HERD: Trump tapping 2 House Republicans for future admin fuels concerns about slim majority…Read more TAKING OVER: Trump expected to visit Capitol Hill on Wednesday, Mike Johnson says…Read more House Speaker Mike Johnson of La., speaks before Republican presidential nominee former President Donald Trump at a campaign rally at Madison Square Garden, Sunday, Oct. 27, 2024, in New York.  OUT OF LEFT FIELD: Tufts University accused of severing ties with House Democrat over trans athlete comments…Read more CALIFORNIA CONCESSION: California Republican congressman concedes competitive race to Democratic challenger…Read more HOUSE VACANCY: Who could run to replace Stefanik in the House?…Read more NON-CONCESSION STAND: Bob Casey refuses to concede PA Senate race, as Schumer welcomes Republican McCormick among new senators…Read more Schumer did not invite McCormick to Senate orientation despite the race being called by AP. (Reuters) TICKET SPLITTERS: AOC bombarded with comments after asking followers why they supported her and Trump…Read more 'CHAMPION OF LIBERTY': Rand Paul backs Kat Cammack for House Republican Conference Chair, Rick Scott for Senate Majority Leader…Read more PRESSURE CAMPAIGN: Pressure campaign boosting Rick Scott could fall flat with Senate GOP colleagues, strategists say…Read more TO KEEP OR TO TOSS: New York Judge Merchan to decide whether to dismiss Trump guilty verdict in Bragg case after election win…Read more BROAD SWINGS: In election victory, Trump’s gains went beyond the battlegrounds…Read more The 2024 presidential election was marked by broad swings in favor of President-elect Trump across the country, including pickups of several key counties. (Fox News) 2028 PREVIEW: Vance in 'catbird seat' for 2028 GOP presidential nomination, but these Republicans may also run…Read more CARLOS DANGER RETURNS: Anthony Weiner mulls return. Disgraced ex-pol says New York City needs new leadership…Read more Get the latest updates on the Trump presidential transition, incoming Congress, exclusive interviews and more on FoxNews.com. This article was written by Fox News staff. ",https://www.foxnews.com/politics/fox-news-politics-11-12-draft
23,General Politics,2024,11,Trump thanks Biden for 'smooth transition' during White House meeting,Brooke Singman,"President-elect Donald Trump met with President Biden in the Oval Office on Wednesday, vowing a 'smooth transition' of power between the administrations. WASHINGTON - President-elect Trump and President Biden both pledged a smooth transition between administrations, as they met at the White House on Wednesday morning.  ""I look forward…to having a smooth transition. We'll do everything we can to make sure you're accommodated, what you need,"" President Biden said as cameras and reporters were briefly allowed in the Oval Office for the meeting. Speaking second, Trump emphasized that ""politics is tough and in many cases it’s not a very nice world, but it is a nice world today. ""I appreciate very much the transition that's so smooth. It will be as smooth as it can get, and I very much appreciate that, the former and future president added. LOYALTY MATTERS: TRUMP PICKS ALLIES AND SUPPORTERS TO FILL OUT HIS SECOND ADMINISTRATION President Joe Biden meets with President-elect Donald Trump in the Oval Office of the White House, Wednesday, Nov. 13, 2024, in Washington. (AP Photo/Evan Vucci) (AP Photo/Evan Vucci) Trump returned to 1600 Pennsylvania Avenue just over a week after his sweeping election victory, as he made his first stop back at the White House in nearly four years. He arrived at the White House at the invitation of Biden, the politician he knocked out of the 2024 presidential race. For Biden - who ended his own re-election bid in July, a month after his disastrous debate performance against Trump reignited questions over whether the 81-year-old president was physically and mentally up for another four years in the White House and sparked calls for him to drop out of the race - the meeting with his predecessor and now successor was likely awkward. HERE ARE THE DEMOCRATS WHO MAY RUN FOR THE WHITE HOUSE IN 2028 Trump spent years verbally eviscerating Biden and his performance in the White House. And even after Biden ended his re-election bid, Trump continued to slam the president and his successor atop the Democrats' 2024 ticket - Vice President Kamala Harris. President Joe Biden meets with President-elect Donald Trump in the Oval Office of the White House, Wednesday, Nov. 13, 2024, in Washington. (AP Photo/Evan Vucci) (AP Photo/Evan Vucci) And Biden, for a couple of years, has labeled Trump a threat to the nation's democracy. But Biden, a traditionalist, wants to ensure a smooth transition between administrations. Biden's offer to Trump to visit the White House was an invitation he himself was never accorded. Four years ago, in the wake of his election defeat at the hands of Biden, Trump refused to concede and tried unsuccessfully to overturn the results. VANCE IS THE FRONT-RUNNER, BUT HERE'S WHO ELSE MAY RUN FOR THE 2028 GOP PRESIDENTIAL NOMINATION Breaking with longstanding tradition, Trump didn't invite Biden to the White House. And two weeks after the Jan. 6, 2021 attack on the U.S. Capitol by Trump supporters aiming to upend congressional certification of Biden's Electoral College victory, Trump left Washington ahead of the presidential inauguration of his successor, becoming the first sitting president in a century and a half to skip out on a successor's inauguration. According to sources, incoming White House Chief of Staff Susie Wiles and current White House Chief of Staff Jeff Zients were in attendance on Wednesday as Trump and Biden met behind closed doors. ""President Biden's decision to welcome President-elect Trump to the White House is a tribute to normalcy in the presidential transition process. What was denied to Joe Biden following his election, is being restored to Biden's credit,"" veteran political scientist Wayne Lesperance told Fox News. President Joe Biden meets with President-elect Donald Trump in the Oval Office of the White House, Wednesday, Nov. 13, 2024, in Washington. (AP Photo/Evan Vucci) (AP) Lesperance, the president of New Hampshire-based New England College, called the invitation by Biden "" a remarkable gesture in that it legitimizes Trump's return to power by the nation's leading Democrat and, hopefully, will be met with a commitment to orderly transitions in the future."" The meeting will be the first between Biden and Trump since they faced off on June 27 in Atlanta, Georgia, in their one and only debate. The two presidents - along with Harris and Trump's running mate and now vice president-elect, Sen. JD Vance - stood next to each other on Sept. 11 in New York City's Lower Manhattan, at ceremonies for the 23rd anniversary of the 9/11 terrorist attacks. CLICK TO GET THE FOX NEWS APP This was Trump's second meeting at the White House with a departing president. Eight years ago, after defeating Democratic nominee Hillary Clinton, Trump sat down at the White House with President Barack Obama, who was finishing up his second term steering the nation. ""We now are going to want to do everything we can to help you succeed. Because, if you succeed, then the country succeeds,"" Obama told Trump at the time. While a tradition, the meeting between the incoming and outgoing presidents is not mandated. Brooke Singman is a political correspondent and reporter for Fox News Digital, Fox News Channel and FOX Business. ",https://www.foxnews.com/politics/trump-thanks-biden-smooth-transition-during-white-house-meeting
