ID,PageTopic,Year,Month,Title,Author,Content,Link
91,Congress,2024,9,Dem House candidate pushes tough on fentanyl stance after dismissing it as border issue,Aubrie Spady,"Fox News’ Griff Jenkins and Alicia Acuna discuss the latest news emerging from the U.S. border ahead of the new Fox Nation special, ‘Fentanyl: America’s Quiet Killer.’ Democratic congressional candidate Monica Tranel appears to be changing her tune on the fentanyl crisis this cycle after previously suggesting that the deadly drug was not coming from the southern border. Tranel, the Democratic candidate running in Montana's First Congressional District against Republican incumbent Rep. Ryan Zinke, recently released a campaign ad appearing tough on the border. However, during her first congressional bid in 2022, Tranel claimed that the border crisis is unrelated to fentanyl trafficking while debating Zinke at the City Club Missoula. ""It is a significant issue where we are, but where it is coming from is not the southern border,"" Tranel said of fentanyl during the debate. ""It's being made in China, and how it's getting here is a complex series of things that are happening, and shutting down the border is not going to reduce the fentanyl crisis."" TOP HANDICAPPER GIVES GOP'S TIM SHEEHY EDGE AGAINST DEMOCRAT JON TESTER IS MONTANA RACE SHIFT Democratic candidate Monica Tranel is running for Congress against Rep. Ryan Zinke. (William Campbell) Shortly after Tranel's remarks at the debate, the U.S. Department of Justice announced that 36 million lethal doses of fentanyl had been removed from American communities between May to September 2022, with 35 cases linking directly to Mexican cartels. As she makes another bid for the Republican-held seat in 2024, Tranel is appearing to shift her stance on the issue. NRA BETS BIG ON MONTANA IN GUN RIGHTS PUSH AS TESTER TEETERS IN SENATE RACE ""We have a real crisis at the border,"" Tranel said in a new campaign ad posted on X in September. ""We need to secure the border, hire more border patrol agents, and go after the drug cartels to stop the flow of illegal drugs like fentanyl."" U.S. Customs and Border Protection's Port Director, Michael Humphries, presents photographs of seized fentanyl, weapons, and other illicit drugs during an interview at The Nogales-Mariposa Port of Entry in Nogales, Arizona on February 28, 2023.   (Kitra Cahana) ""Trainwreck Tranel is talking tough on the border now that it’s an election year, but Montanans know she will work directly under the Harris-Walz banner to unleash more crime and border chaos on Montanans while also supporting boys to play in girls sports,"" Madison Atkinson, Montana GOP spokesperson, told Fox News Digital in a statement. In fiscal year 2023 alone, Border Patrol agents reported seizing enough fentanyl to kill the entire U.S. population. Asked about the previous comment regarding fentanyl, Tranel told Fox News Digital that ""we need to secure our border and solve the fentanyl crisis."" Tranel is running against Rep. Ryan Zinke, the Republican incumbent seeking re-election in Montana's First Congressional District. (Al Drago) ""We need to increase resources for border patrol and go after the cartels trafficking fentanyl, both in China and at the border,"" she told Fox. ""The border bill would have increased resources for detection and stopping fentanyl from coming in. I support that bill and would have voted for it. Stopping the supply side of fentanyl is critical, and keeping it from coming in across any border is also critical. As a member of Congress, I would have voted to get that done. Ryan Zinke could have voted for that bill but did not, in order to play games and campaign on the issue rather than solve it."" CLICK HERE TO GET THE FOX NEWS APP ""The border isn’t secure, and no one – including Rep. Zinke – has actually gotten the job done to fix it,"" Tranel said. ""I’ll stand up to any Democrat or Republican who gets in the way. While Zinke cozies up to special interests and China, I’m focused on protecting our communities and stopping the flow of illegal drugs. Keeping Montana safe is more important than politics.""  Aubrie Spady is a Writer for Fox News Digital. ",https://www.foxnews.com/politics/dem-house-candidate-pushes-tough-fentanyl-stance-after-dismissing-border-issue
92,Congress,2024,9,"Taxpayers lost more than $100B to COVID unemployment insurance fraud, committee finds",Brooke Singman,"Rep. Brad Wenstrup, R-Ohio, discusses the reported $280 billion in COVID relief funds fraud and calls for better guard rails in place for the future on 'Your World.' FIRST ON FOX: American taxpayers lost more than $100 billion to fraud and improper payments as a result of temporary unemployment insurance programs created in response to COVID-19, the House Oversight Committee found.  Fox News Digital obtained the House Oversight Committee's report after its monthslong investigation examining fraud in pandemic unemployment relief programs.  The report details information, documents and communications obtained by the committee showing how states across the country, including California, New York and Pennsylvania, processed and administered pandemic unemployment insurance claims with ""minimal oversight.""  The committee said that lack of oversight led to ""billions of taxpayer dollars lost to improper and fraudulent payments that will likely never be recovered.""                            Brooke Singman is a political correspondent and reporter for Fox News Digital, Fox News Channel and FOX Business. ",https://www.foxnews.com/politics/taxpayers-lost-more-than-100b-covid-unemployment-insurance-fraud-committee-finds
93,Congress,2024,8,Kyle Kilbourn wins Democratic primary battle for Wisconsin House seat,Fox News,"Rep. Tom Tiffany, R-Wis., provides insight on responding to the war in Israel on 'The Ingraham Angle.' Kyle Kilbourn won the Democratic primary for Wisconsin's 7th Congressional District, setting the stage for a battle with incumbent Republican Rep. Tom Tiffany. The primary saw two Democratic candidates competing for their party's nomination. Air Force veteran and congressional candidate Elsa Duranceau is a University of Wisconsin-Madison graduate who works with local community collaboration efforts for child care, elder care and rural small business development.  Duranceau ran ""to continue my work influencing public programs and policies,"" according to her campaign website. JD VANCE ROASTS HARRIS ON WISCONSIN TARMAC FOR AVOIDING PRESS, CALLS AIR FORCE 2 HIS ‘FUTURE PLANE’      ",https://www.foxnews.com/politics/kyle-kilbourn-wins-democratic-primary-house-seat-held-gop-rep-tom-tiffany
94,Congress,2024,9,Andrew Cuomo will finally face questions over COVID deaths. Will my family and others learn the truth?,Janice Dean,"Fox News congressional correspondent Aishah Hasnie has more as the former New York governor defends his record for handling the coronavirus pandemic on 'Special Report.'  On Tuesday, September 10, former New York Gov. Andrew Cuomo will be testifying publicly before Congress for the first time regarding his COVID-19 nursing home policies and the March 25, 2020, directive that brought in over 9,000 coronavirus patients into care facilities across the state. Many of us will be very interested in the subcommittee’s findings and their report, which will be made public in the next few weeks. Our families have been waiting years for this moment, and it’s hard to put into words what it will be like to finally be in the same room as the person who many of us believe had a hand in the deaths of our loved ones.  I’ve said many times that had Gov. Cuomo expressed any kind of remorse for his actions, met with families or wrote condolence cards instead of chasing a $5 million dollar book deal while tens of thousands of New Yorkers were dying alone, we wouldn’t be where we are today: still waiting for answers and accountability.                          Janice Dean joined FOX News Channel (FNC) in January 2004 where she currently serves as senior meteorologist for the network. In addition, she is the morning meteorologist for FNC’s signature morning show, FOX & Friends (weekdays 6-9AM/ET) as well as contributes to FOX Weather, FOX News Media’s free ad-supported streaming television (""FAST"") weather service. Click here to listen to ""The Janice Dean Podcast."" ",https://www.foxnews.com/opinion/andrew-cuomo-finally-face-questions-over-covid-deaths-my-family-others-learn-truth
95,Congress,2024,8,Reporter's Notebook: What the end of the year looks like in Congress,Chad Pergram,"Fox News senior congressional correspondent Chad Pergram reports that Vice President Kamala Harris’ policy plans rely on Congress’ balance of power on ‘America’s Newsroom.’ Congress does not return to session until Sept. 9, and the only thing the House and Senate must absolutely do the rest of the year is fund the government. The problem is that Congress does not have until Dec. 31. The government’s fiscal year deadline is Oct. 1. THE HOME STRETCH: VP HARRIS FILLS DEMOCRATS WITH OPTIMISM AS ELECTION DAY NEARS As per usual, expect a veritable adventure between now and October – if not the end of the year and maybe into 2025 – over how Congress might sidestep a government shutdown. The House Freedom Caucus issued an ultimatum. The coalition of the House’s most-conservative members wrote to House Speaker Mike Johnson, R-La., demanding a simple at current levels – known as a Continuing Resolution (CR) – through ""early 2025."" The Freedom Caucus is banking on a return of former President Donald Trump to the White House – to say nothing of the supposition that Republicans will hold the House and flip the Senate. Recent polling is starting to favor Vice President Kamala Harris. The chances of Republicans holding the House are a jump ball at best – and may trend toward Democrats. Political handicappers have long favored Republicans to seize control of the Senate, but that’s not a done deal, either.                     Chad Pergram currently serves as a senior congressional correspondent for FOX News Channel (FNC). He joined the network in September 2007 and is based out of Washington, D.C. ",https://www.foxnews.com/politics/end-year
96,Congress,2024,9,"Chinese military company's machinery in use at nation's top secret research lab, Oversight Committee says",Morgan Phillips,"Heritage Foundation senior fellow Michael Pillsbury reacts to the arrest of an alleged Chinese agent on 'Fox News Live.' EXCLUSIVE: The House Oversight Committee says it is aware of a machine operated by a Chinese military company that is in use at the nation’s most secretive government laboratories.  ""We are aware that there is a BGI machine at Los Alamos,"" a committee spokeswoman told Fox News Digital.   Situated in rural New Mexico, Los Alamos is one of the most top-secret labs in the country where the atomic bomb was produced under the Manhattan Project in 1943.  The spokeswoman noted the BIOSECURE Act, which passed the House on Monday, would ban the machinery at Los Alamos by prohibiting U.S. taxpayer dollars from flowing to biotech companies that are owned, operated, or controlled by China or other foreign adversaries.                    The high-thoroughput DNA sequencing platform is allegedly in use at Los Alamos National Laboratory Genomic Core ",https://www.foxnews.com/politics/chinese-military-machinery-use-nations-most-top-secret-research-lab-oversight-committee-says
97,Congress,2024,9,Race to replace GOP governor in swing state on tap as primary season comes to a close on Tuesday,Paul Steinhauser,"Former Sen. Kelly Ayotte, who's running for governor in New Hampshire's competitive race, tells Fox News Digital she'd welcome the endorsements of former President Trump and Gov. Chris Sununu. NEWFIELDS, N.H. — After six months of contests, the final states hold primaries in the 2024 election cycle as voters in Delaware, New Hampshire and Rhode Island head to the polls on Tuesday. And grabbing the most attention, the competitive and combustible Republican and Democrat gubernatorial primaries in New Hampshire in the race to succeed GOP Gov. Chris Sununu, who isn't running for re-election after winning four straight two-year terms as the Granite State governor. And the race in New Hampshire, a perennial general election swing state, is considered by political pundits as the only competitive governor's race in the nation this year. HEAD HERE FOR THE LATEST FOX NEWS ELECTION RESULTS                                    ",https://www.foxnews.com/politics/race-replace-gop-governor-blue-as-primary-season-close-tuesday
98,Congress,2024,8,Cory Mills wins reelection in Florida's 7th Congressional District,Aubrie Spady,"Rep. Cory Mills, R-Fla., explains why he doesn’t think Kamala Harris can keep Americans safe as president when dealing with foreign adversaries and reacts to new video from the Trump assassination attempt. Former combat veteran and incumbent Rep. Cory Mills, R-Fla., won the Republican primary to defend his seat in Florida's 7th Congressional District Tuesday night.  Mills, who served in both Afghanistan and Iraq, has represented the seat since 2023. The veteran received a certificate of appreciation from the U.S. Embassy in Baghdad after being injured twice while overseas. The Republican congressman was a staunch former President Trump supporter throughout his first term, standing with Trump in Manhattan criminal court in May as the former president faced 34 felony counts of falsifying business records. CLOSE CONTEST BETWEEN TRUMP AND HARRIS IN THIS BATTLEGROUND STATE TURNED RED: POLL      Aubrie Spady is a Writer for Fox News Digital. ",https://www.foxnews.com/politics/cory-mills-wins-republican-primary-floridas-7th-congressional-district
99,Congress,2024,8,"On this day in history, August 18, 1920, the 19th Amendment is ratified, granting women the right to vote",Kerry J. Byrne,"Brian Kilmeade sits down with Jane Hampton Cook to to learn about the Women's Suffrage Movement on Fox Nation's 'What Made America Great' The 19th Amendment to the U.S. Constitution, which secured for women the right to vote, was ratified on this day in history, August 18, 1920. It is considered one of the great landmarks in the fight for gender equality. The amendment was often called the Susan B. Anthony Amendment, in reference to the renowned suffragist whose extraordinary efforts championed the right of women to be heard at the ballot box.  ON THIS DAY IN HISTORY, WYOMING TERRITORY FORMED, PROVED GLOBAL LEADER FOR WOMEN'S SUFFRAGE ""From the earliest history of our country, woman has shown equal devotion with man to the cause of freedom and has stood firmly by his side in its defense,"" Anthony wrote in her Declaration of Rights of the Women of the United States of July 4, 1876.                                   Kerry J. Byrne is a lifestyle reporter with Fox News Digital. ",https://www.foxnews.com/lifestyle/this-day-history-aug-18-1920-19th-amendment-ratified-women-right-vote
100,Congress,2024,8,Former Rep. Nancy Boyda wins Democratic primary for open seat in Kansas' 2nd Congressional District,Aubrie Spady,"Fox News Flash top headlines are here. Check out what's clicking on Foxnews.com. Former Rep. Nancy Boyda, who represented Kansas' 2nd Congressional District in 2006, was declared the victor in the Democratic primary on Tuesday night.   The Sunflower State seat is currently held by Republican Rep. Jake LaTurner, who is not seeking re-election this fall.  Aside from Boyda's two-year term ending in 2008, the seat has been held by Republicans for nearly 30 years. THE KANSAS SUPREME COURT HAS RULED THAT VOTING IS NOT A FUNDAMENTAL RIGHT. WHAT'S NEXT FOR VOTERS?    Aubrie Spady is a Writer for Fox News Digital. ",https://www.foxnews.com/politics/boyda-wins-democratic-primary-red-seat-kansas-2nd-congressional-district
101,Congress,2024,8,Strategists pin GOP Senate hopes on Trump base coming 'home' ahead of election,Julia Johnson,"Former Michigan Representative and Senate candidate Mike Rogers speaks on his campaign efforts, Trump's efforts in the state, and the problems Michiganders are facing. Republican strategists are predicting a GOP voter homecoming to support Senate hopefuls and down-ballot Republicans in critical states on election day, despite current figures showing their candidates at a disadvantage.  ""A lot of the Trump vote just hasn't put their jersey on for the Republican candidate yet,""one veteran Republican strategist said.  However, those voters are expected to ""come home"" and ""vote straight ticket Republican.""  In Pennsylvania, a top battleground state, Republican Senate candidate Dave McCormick trailed Sen. Bob Casey, D-Penn., in a New York Times and Siena College poll earlier this month. Half of registered voters in the state opted for the incumbent Democrat, with just 36% saying they would vote for McCormick.                                            Julia Johnson is a politics writer for Fox News Digital and Fox Business, leading coverage of the U.S. Senate. She was previously a politics reporter at the Washington Examiner.  Follow Julia's reporting on X at @JuliaaJohnson_ and send tips to Julia.Johnson@fox.com. ",https://www.foxnews.com/politics/strategists-pin-gop-senate-hopes-trump-base-coming-home-ahead-election
102,Congress,2024,10,Wisconsin Senate race shifts to 'toss up' by handicapper as Tammy Baldwin fights for re-election,Julia Johnson,"Wisconsin Republican Party Executive Director Andrew Iverson emphasized the ground game strategy in the battleground that includes turning out Republican voters in deep blue areas. A top political handicapper shifted its rating for the Wisconsin Senate race on Tuesday to ""Toss Up"" with less than a month until Election Day.  The race in Wisconsin, a pivotal battleground state in both the presidential and Senate matches, was most recently considered ""Lean Democrat"" by the Cook Political Report. TRUMP, REPUBLICANS VENTURE TO BLUE AREAS IN WISCONSIN TO BOOST GOP TURNOUT Tammy Baldwin and Eric Hovde will face off in the election in November. (Getty Images) The handicapper cited changes in polling in recent days, with Hovde appearing to close the gap with Baldwin. But Cook also referred to private polling from both campaigns, which it said each showed the race within the margins of error.  A source familiar confirmed to Fox News Digital that Baldwin's internal polling shows such a race.  VULNERABLE DEM JON TESTER TURNS ON BIDEN ADMIN OVER DEI AFTER MONTANA UNIVERSITIES STRIPPED OF FEDERAL FUNDS Baldwin is a two-term senator. (Drew Angerer) In response to the rating shift, Hovde spokesman Zach Bannon said, ""Sen. Baldwin's radical agenda has sparked record high inflation, created chaos [at] the southern border, and made our communities less safe. Eric Hovde is going to win because the people of Wisconsin are ready for change."" HERE'S WHAT 2 UNDECIDED WISCONSIN VOTERS ARE HOLDING OUT FOR IN 2024 ELECTION Hovde has started to close the polling gap with Baldwin. (Scott Olson/Getty Images) ""After 25 years in Washington, Tammy Baldwin has become the typical D.C. politician, voting in lockstep with the failed Biden agenda and hiding her Wall Street partner's stock trades from her constituents. Wisconsinites are ready for change, and Eric Hovde has the momentum,"" said National Republican Senatorial Committee (NRSC) spokesman Tate Mitchell in a statement. SENATE REPUBLICANS MARK OCT 7 ATTACK 1 YEAR OUT AS ISRAEL-HAMAS WAR CONTINUES A woman dons a cheese hat with an American flag on it in Wisconsin. (Reuters) The latest Marquette Law School poll showed Baldwin winning the battle, 51% to Hovde's 45%. The survey interviewed 882 registered voters over Sept. 18-26. The poll's margin of error was +/-4.4 percentage points.  CLICK HERE TO GET THE FOX NEWS APP The most recent Fox News Power Rankings from last month had Wisconsin at ""Leans Dem."" With Cook's ratings change, Wisconsin joins other ""Toss Up"" Senate races in Ohio and Michigan.  Get the latest updates from the 2024 campaign trail, exclusive interviews and more at our Fox News Digital election hub. Julia Johnson is a politics writer for Fox News Digital and Fox Business, leading coverage of the U.S. Senate. She was previously a politics reporter at the Washington Examiner.  Follow Julia's reporting on X at @JuliaaJohnson_ and send tips to Julia.Johnson@fox.com. ",https://www.foxnews.com/politics/wisconsin-senate-race-shifts-toss-up-handicapper-tammy-baldwin-fights-re-election
103,Congress,2024,8,Social Security marks 89th year as retirement fund risks insolvency under Democrats,Peter Burke,"He'd make benefits tax-free, but the costs could be significant.   Social Security has just turned 89 years old, but there are questions about its solvency headed into the November presidential election. The Social Security Act was signed into law by President Franklin D. Roosevelt on Aug. 14, 1935, as a way of establishing a federal benefits system for older Americans. Today, Social Security's trust fund for retirement benefits is projected to be depleted by 2033, leaving lawmakers up against the clock on possible solutions for saving the program. MOST US ADULTS WORRY ABOUT FUTURE OF MEDICARE, SOCIAL SECURITY, GALLUP POLL FINDS: 'MAGNITUDE OF CONCERN' A Gallup poll released in June revealed that 80% of Americans are ""worried"" or ""extremely worried"" about a lack of being available to them when they need that help.                                              Peter Burke is a lifestyle editor with Fox News Digital.  ",https://www.foxnews.com/lifestyle/social-security-marks-89th-year-retirement-fund-risks-insolvency-under-democrats
104,Congress,2024,9,Michigan becomes a top GOP Senate target as Mike Rogers ties with Dem opponent among older voters,Julia Johnson,"Former Michigan representative and Senate candidate Mike Rogers speaks about his campaign efforts, Trump's efforts in the state and the problems Michiganders are facing. The Senate race in Michigan has emerged as a much bigger Republican pickup opportunity than originally imagined as former Rep. Mike Rogers recently tied his Democrat opponent with a key group, according to a new poll.  Michigan Republican strategist Jason Cabel Roe was not initially expecting the Republican traction that Rogers is now seeing in the state due to Michigan's recent history of electing primarily Democrat senators.  GOP operatives have agreed that the Michigan race's status has come as a welcome surprise.  ""It seems like Michigan may be a little bit more competitive than Ohio,"" a senior Republican strategist told Fox News Digital, remarking that races in West Virginia, Montana and Ohio have been traditionally understood as the best Republican opportunities this cycle.                       Julia Johnson is a politics writer for Fox News Digital and Fox Business, leading coverage of the U.S. Senate. She was previously a politics reporter at the Washington Examiner.  Follow Julia's reporting on X at @JuliaaJohnson_ and send tips to Julia.Johnson@fox.com. ",https://www.foxnews.com/politics/michigan-becomes-top-gop-senate-target-mike-rogers-ties-dem-opponent-among-older-voters
105,Congress,2024,8,"Beware the Ides of July: Trump assassination attempt, Biden ends reelection campaign in wild month",Chad Pergram,"Fox News senior congressional correspondent Chad Pergram reports on efforts to track down six pro-Hamas protesters accused of assault and vandalism during violent demonstrations last week. It’s customary for me to write a piece this month titled ""Beware the Ides of August."" It’s a take on Shakespeare, where Julius Caesar is warned ""Beware the Ides of March."" The middle of March is what spells doom for Caesar. And over the years, I have found that the month of August – often the midway point – to be the most dramatic, historic and often volatile period in politics and government. Richard Nixon resigned the presidency in August 1974. The U.S. dropped nuclear bombs on Hiroshima and Nagasaki in August 1945. Martin Luther King Jr., gave his ""I Have a Dream"" speech in August 1963. There was the riot in Charlottesville, Va., in August 2017. There was even an earthquake in Washington, DC in August 2011. And not the political kind. Will August 2024 measure up? REPORTER'S NOTEBOOK: A PORTRAIT OF MIDDLETOWN, OHIO, HOME TO JD VANCE                         Chad Pergram currently serves as a senior congressional correspondent for FOX News Channel (FNC). He joined the network in September 2007 and is based out of Washington, D.C. ",https://www.foxnews.com/politics/beware-ides-july-trump-assassination-attempt-biden-ends-reelection-campaign-wild-month
