ID,PageTopic,Year,Month,Title,Author,Content,Link
47,Congress,2024,9,GOP bill targeting 'Chinese billionaire loophole' on EVs passes after clash with Dems,Aubrie Spady,"Former President Trump discusses his relationship with Elon Musk and an electric vehicle mandate on 'Life, Liberty & Levin.' Lawmakers sparred on Capitol Hill before passing legislation to prevent prohibited foreign entities from obtaining U.S. tax credits on electric vehicles.  The Republican-introduced End Chinese Dominance of Electric Vehicles Act was brought to the House floor for discussion on Thursday before passing with seven Democrats voting in support of the bill. The bill will amend the Internal Revenue Code of 1986 to exclude electric vehicle batteries sourced from a foreign entity of concern (FEOC), such as China, from the clean vehicle credit. The legislation will tighten the FEOC definition for the 30D electric vehicle (EV) tax credit and prevent companies who partner with those entities from benefiting from the tax break. Before voting on the legislation, Republican proponents of the bill urged their fellow lawmakers to ""choose American taxpayers over Chinese billionaires."" NEW REPORT SOUNDS ALARM ON CHINA'S ROLE IN DESTROYING US FAMILIES WITH DEADLY DRUG: ‘DESTABILIZING CRISIS’ Rep. Carol Miller introduced the End Chinese Dominance of Electric Vehicles Act in April 2024. (Bill Clark/Getty Images) Rep. Carol Miller, R-W.Va., who introduced the bill in April, said the legislation would ""close the Chinese billionaire loophole"" by preventing them from benefiting from EV subsidies. The vote was 217-192. CHINESE MILITARY COMPANY'S MACHINERY IN USE AT NATION'S TOP SECRET RESEARCH LAB, OVERSIGHT COMMITTEE SAYS Rep. Jason Smith, R-Mo., pointed to Vice President Kamala Harris for casting the tie-breaking vote on the Inflation Reduction Act of 2022 – which established the tax subsidies for electric vehicles. ""For years, the Chinese Communist Party has been doing everything it can do to dominate the electric vehicles market,"" Smith said on the House floor. ""The Harris-Biden administration is now using American taxpayer dollars to further China's dominance of the EV market."" A Chevrolet Bolt charges at a station in Hudson, New York, on Tuesday, Sept. 3, 2024. (Angus Mordant/Getty Images) Smith butted heads with the bill's Democratic critics, saying the fiery speech by Rep. Debbie Dingell, D-Mich., against the legislation was ""hogwash."" Rep. Judy Chu, D-Calif, called the legislation ""another excuse by Republicans to undermine the Inflation Reduction Act,"" while Rep. Dan Kildee, D-Mich., argued that ""this bill would make it harder for us to compete with China."" Rep. Dingell introduced a motion to recommit the bill. (Al Drago) CLICK HERE TO GET THE FOX NEWS APP Rep. Dingell introduced a motion to recommit the bill to the Ways and Means Committee, but it did not pass after a yea and nay vote.  Fox News' Morgan Phillips contributed to this report. Aubrie Spady is a Writer for Fox News Digital. ",https://www.foxnews.com/politics/gop-bill-targeting-chinese-billionaire-loophole-evs-passes-clash-dems
48,Congress,2024,11,New Mexico Democratic Rep. Gabriel Vasquez projected to beat Trump-backed GOP challenger,Emma Colton," New Mexico Democratic Rep. Gabriel Vasquez is projected to defeat Republican challenger Yvette Herrell, holding on to his seat for a second term.  Vasquez and Herrell previously squared off in the 2022 election cycle, when Vasquez won by less than 1%. Vasquez has represented New Mexico’s 2nd Congressional District, which encompasses Las Cruces and a southern portion of Albuquerque, since 2023. The race was considered a toss-up, with the Democratic Congressional Campaign Committee (DCCC) identifying the district as vulnerable for defeat against Republican challengers this election cycle.  Vasquez touted expanding the economy, protecting abortion access, combating climate change and passing ""comprehensive"" immigration laws as his campaign platforms.  PRO-DEFUND POLICE DEM IN KEY RACE ONCE THREATENED TO 'KILL' AND 'BURY' MAN OVER THE PHONE: POLICE RECORDS Democratic Rep. Gabe Vasquez and Republican challenger Yvette Herrell (Reuters | Getty ) The congressman came under fire from conservatives in the lead-up to the election, including for his previous comments supporting defunding the police.  Vasquez appeared on a local news station seemingly dressed in disguise during the 2020 George Floyd unrest and said, ""It's not just about defunding police, it's about defunding a system that privileges White people over everyone else."" Vasquez previously vowed he would ""fully support"" cutting in half the police budget of Las Cruces, where he served on the city council, Fox News Digital previously reported. BALANCE OF POWER: FIVE RACES THAT COULD DECIDE CONTROL OF THE HOUSE IN NOVEMBER Rep. Gabe Vasquez speaks during a news conference in Albuquerque, New Mexico, on Oct. 3, 2024. (Anna Padilla/Bloomberg via Getty Images) ""I wholeheartedly and absolutely support police reform and the #blacklivesmatter movement, and will not be stopping short of transformational reform that brings justice to our city and to people of color in our community. You can count on my support,"" Vasquez wrote to a constituent demanding ""at least"" a 50% reduction of the Las Cruces police department budget. He has since said he opposes defunding the police.  VULNERABLE DEMS WON'T SAY WHETHER BIDEN SHOULD BE NOMINEE: 'PRESIDENT CAN MAKE HIS OWN DECISIONS' Vasquez served on the Las Cruces City Council from 2017 to 2021 before launching his career in the U.S. House.  Reps. James Comer and Yvette Herrell tour the border wall on the Johnson Ranch near Columbus, New Mexico, on April 12, 2021. (Bill Clark/CQ-Roll Call, Inc via Getty Images) Herrell campaigned on a platform of securing the border, bucking the ""political class in Washington"" that has ""forgotten about the hardworking, middle-class of America,"" building the economy and ""putting New Mexico first."" Former President Trump endorsed Herrell earlier this year, when she won the Republican primary.  ""A successful entrepreneur, Yvette knows how to Expand our Economy, Fight Inflation, and Create High-Paying Jobs,"" Trump wrote. ""She will work hard to Lower Gas Prices, Support our Vets, Strengthen our Military, Secure our Border, and Defend the Second Amendment."" Herrell served in New Mexico House of Representatives from 2011 to 2019, and in Congress from 2021 to 2023. CLICK HERE TO GET THE FOX NEWS APP Fox News Digital's Andrew Mark Miller contributed to this report.  ",https://www.foxnews.com/politics/new-mexico-democratic-rep-gabriel-vasquez-projected-beat-trump-backed-gop-challenger
49,Congress,2024,10,Anti-Israel agitators set up encampment outside Jewish Dem rep's home on eve of Oct 7 Hamas attack anniversary,Alex Nitzberg,"'Fox & Friends Weekend' co-hosts Pete Hegseth and Will Cain go off the wall and break down the events of the conflict in Israel a year since the October 7 attack. Anti-Israel protesters set up an encampment outside the home of a Jewish Democratic House member on the eve of the anniversary of the Oct. 7 Hamas terror attacks, the congressman revealed on social media. Rep. Greg Landsman, D-Ohio, posted on X overnight announcing that a group of people with their faces covered had congregated outside his house, prompting his family to get police escorts in order to exit and enter their home. ""A group of masked anti-Israel protesters assembled outside my home early Sunday morning and remained through the evening, forcing police to escort my family in and out of our house for safety,"" the lawmaker declared in a post that included a photo of the group. ""The protesters refuse to leave, setting up tents, cots, and sleeping bags in their encampment in the road, and are spending the night harassing my family outside our home. It's not clear if or when they will leave,"" he added in another tweet.               Alex Nitzberg is a writer for Fox News Digital. ",https://www.foxnews.com/politics/anti-israel-agitators-set-encampment-outside-jewish-dem-reps-home-eve-oct-7-hamas-attack-anniversary
50,Congress,2024,11,The 2024 election cycle is drawing to a close –⁠ here's what we know,Chad Pergram," Fox News senior congressional correspondent Chad Pergram has the latest on the balance of power in Congress on 'Special Report.' There was some shock at the outcome of last week’s election. But when it comes to control of the House and Senate, things generally landed in the range anticipated by many learned observers. There was a high probability of a Republican Senate – with the GOP likely having a seat or two to cushion a majority. The House of Representatives was expected to be close. The forecast was that the House breakdown would probably reflect the split between the majority and minority today. The only question was which party would be in the majority. And there was a high likelihood that control of the House would mirror the outcome of the Presidential election.                                         Chad Pergram currently serves as a senior congressional correspondent for FOX News Channel (FNC). He joined the network in September 2007 and is based out of Washington, D.C. ",https://www.foxnews.com/politics/2024-election-cycle-drawing-close-e281a0-heres-what-we-know
51,Congress,2024,9,Top senators briefed on 'major errors' leading up to Trump assassination attempt,Julia Johnson,"Lawmakers said an interim report is expected to be released on what they've learned so far about the shooting. A handful of leading senators on the Homeland Security and Governmental Affairs Committee (HSGAC) were briefed Thursday by Acting U.S. Secret Service Director Ronald Rowe on the investigation into the July assassination attempt against former President Donald Trump.  ""I think the American people are going to be shocked, astonished and appalled by what we will report to them about the failures by the Secret Service in this assassination attempt on the former president,"" HSGAC Permanent Subcommittee on Investigations (PSI) Chairman Richard Blumenthal, D-Conn., told Fox News Digital following the briefing.  The senator refused to go into details about what he had heard in the meeting, however.  DEMS RUN ON BORDER BILL REPUBLICANS SAY 'WAS NEVER DESIGNED TO SOLVE THE PROBLEM' Four top senators on the Homeland Security Committee were briefed on the investigation into the assassination attempt against Trump.  (Reuters) Rowe briefed Blumenthal, PSI Ranking Member Ron Johnson, R-Wis., HSGAC Chairman Gary Peters, D-Mich., and HSGAC Ranking Member Rand Paul, R-Ky., before venturing to the House of Representatives to similarly brief the Task Force on the Attempted Assassination of Donald J. Trump.  ""I do think that the director is attempting to try to make sure this doesn't happen again. And so I do appreciate that he's trying,"" Paul said after exiting the briefing.  TOP HANDICAPPER GIVES GOP'S TIM SHEEHY EDGE AGAINST DEMOCRAT JON TESTER IN MONTANA RACE SHIFT President Trump famously raised his fist and yelled, ‘Fight!’ to the crowd after surviving an assassination attempt in July. (Anna Moneymaker/Getty Images) He added that ""major errors"" had occurred on July 13 when Trump was shot in the ear at an outdoor campaign rally in Butler, Pennsylvania, and one attendee was killed, while two others were critically injured.  He detailed that the committee's bipartisan interim report on the assassination attempt would be coming out in a few days.   ""I think it's going to identify very specific errors that were made in this,"" Paul said.  TEXAS DEM'S SENATE AD FEATURES BORDER WALL HE ONCE BLASTED AS 'RACIST' Johnson was one of the senators briefed.  (Umit Bektas) Peters emphasized that the forthcoming report will ""only be an interim report, because there's a lot more information that we need to find.""  ""We hope once this report comes out, and we can get the additional information necessary to have a complete report of what happened, as well as steps of what we need to do in the future to make sure that this never happens,"" he told Fox News.  ROGERS ADDRESSES ABORTION AMID SLOTKIN ATTACKS: 'MICHIGAN VOTERS HAVE ALREADY DECIDED' Blumenthal predicted that people would be shocked by the report.  (AP Photo/Mariam Zuhaib) Paul additionally told reporters that he had not learned any new information about the shooter's motive or anything else.  CLICK HERE TO GET THE FOX NEWS APP The Secret Service provided senators with an initial briefing just days after the assassination attempt, which left many senators unsatisfied. At the time, Johnson said ""virtually no information"" was shared, and the discussion was primarily meant to ""check the box.""  A Peters aide told Fox News Digital one day after the shooting that the committee would be launching an investigation into the assassination attempt, also revealing that the chairman had been scheduled to speak with Department of Homeland Security (DHS) Secretary Mayorkas that weekend.  Julia Johnson is a politics writer for Fox News Digital and Fox Business, leading coverage of the U.S. Senate. She was previously a politics reporter at the Washington Examiner.  Follow Julia's reporting on X at @JuliaaJohnson_ and send tips to Julia.Johnson@fox.com. ",https://www.foxnews.com/politics/top-senators-briefed-major-errors-leading-up-trump-assassination-attempt
52,Congress,2024,10,"Biden, US lawmakers praise death of Hamas leader Yahya Sinwar by Israel: 'The world is a safer place'",Louis Casiano,"Former Israeli Ambassador to the U.S. Michael Oren says killing of Hamas leader Yahya Sinwar is an incredible moment for Israel, the U.S., and the free world. President Biden and congressional lawmakers praised Israel upon hearing the news that the mastermind behind the Oct. 7, 2023, attacks on the Jewish state had been killed. Hamas leader Yahya Sinwar was eliminated by Israeli forces and was found in rubble in the Gaza Strip, Israeli Prime Minister Benjamin Netanyahu said in a televised message.  ""I stand before you today to inform you that Yahya Sinwar has been eliminated,"" he said. ""He told you he was a lion, but in reality, he was hiding in a dark den – and he was killed when he fled in a panic from our soldiers."" Biden congratulated Israel for the killing, saying it was ""a good day for Israel, for the United States, and for the world.""                             Louis Casiano is a reporter for Fox News Digital. Story tips can be sent to louis.casiano@fox.com. ",https://www.foxnews.com/politics/biden-us-lawmakers-praise-death-hamas-leader-yahya-sinwar-israel-the-world-safer-place
53,Congress,2024,9,Secret Service overhaul talk hits Capitol Hill after Trump assassination attempts,Elizabeth Elkind,"Fox News' David Spunt reports the latest from the DOJ as lingering questions remain. The 'Outnumbered' panel also discusses the demand for accountability after the House passed a bill to bolster USSS protection for presidential candidates. The recent attempts on former President Trump’s life have left some House Republicans questioning whether the U.S. Secret Service (USSS) should remain under the control of the Department of Homeland Security (DHS). ""I think that's something that we should look at — if we need to remove them from Homeland, make them a standalone agency or answer to someone else. I mean, their mission, I think, is entirely different than a lot of the agencies under that Department of Homeland Security umbrella,"" Rep. Michael Guest, R-Miss., vice chair of the Committee on Homeland Security, told Fox News Digital. The Secret Service was established in 1865 as a bureau of the Treasury Department to tackle counterfeiting and was authorized by Congress to provide full-time protection to the president in 1913, according to the agency's website. It was transferred from the Treasury Department to the newly created DHS in 2003.                        Elizabeth Elkind is a politics reporter for Fox News Digital leading coverage of the House of Representatives. Previous digital bylines seen at Daily Mail and CBS News. Follow on Twitter at @liz_elkind and send tips to elizabeth.elkind@fox.com ",https://www.foxnews.com/politics/secret-service-overhaul-talk-hits-capitol-hill-after-trump-assassination-attempts
54,Congress,2024,9,Delaware Democrat advances toward becoming first trans member of Congress,Morgan Phillips,"Fox News White House correspondent Peter Doocy reports on President Biden's reaction to his Super Tuesday victories. Delaware State Sen. Sarah McBride could become the first trans person elected to Congress after she won a primary Tuesday night. McBride ran virtually unopposed as the only candidate in the primary to have raised any funds, and she had the backing of Delaware Sens. Chris Coons and Tom Carper and Rep. Lisa Blunt Rochester, who is running in the Senate race to replace Carper.  McBride already became the first-ever transgender state senator in the U.S. after winning election to the Delaware Senate in 2020. The activist-turned-politician, 33, argues there needs to be more diverse representation in Congress. Delaware’s House seat has been held by Democrats since 2010. President Joe Biden beat former President Donald Trump by 19 points there in 2020. McBride amassed nearly $3 million in contributions from supporters across the country. She first garnered national attention at the 2016 Democratic National Convention as the first openly transgender person to address a major party convention. MCBRIDE ANNOUNCES BID TO BECOME FIRST TRANS MEMBER OF CONGRESS Delaware State Sen. Sarah McBride could become the first trans person elected to Congress after she won a primary Tuesday night. Delaware’s House seat has been held by Democrats since 2010. President Joe Biden beat former President Donald Trump by 19 points there in 2020. McBride amassed nearly $3 million in contributions from supporters across the country. She first garnered national attention at the 2016 Democratic National Convention as the first openly transgender person to address a major party convention. McBride was the only candidate in the primary to have raised any funds and she had the backing of Delaware Sens. Chris Coons and Tom Carper and Rep. Lisa Blunt Rochester McBride will now face off against one of two candidates in the GOP primary.  McBride's candidacy comes amid a fierce national debate over transgender policies, especially as they relate to minors. Republican states over the past few years have passed legislation banning or limiting gender transition services for minors, citing long-term health impacts. BIDEN OFFICIALS PUSHED TO DROP AGE LIMIT ON TRANS SURGERIES FOR MINORS: REPORT  Some female athletes have pushed lawmakers to require transgender people to compete on sports teams that align with their biological sex assigned at birth. McBride argues the legislative push is an example of ""far-right"" extremism. CLICK HERE TO GET THE FOX NEWS APP ""In 2020, I became the first openly trans person elected to serve as a state Senator anywhere in the country. It really felt like America was blazing a path to the future. But since then, the far-right has tried to use the LGBTQ community as a scapegoat for their policy failures,"" McBride wrote on X, formerly Twitter. ""As they’ve increased their attacks on families and kids, it has become even clearer: for our democracy to work, it needs to include all of us. If elected, I’ll be the first openly trans member in Congress."" Fox News' Anders Hagstrom contributed to this report.  ",https://www.foxnews.com/politics/delaware-democrat-first-trans-member-congress
55,Congress,2024,11,Dem Rep Ruben Gallego beats Kari Lake in battle for Arizona Senate seat,Julia Johnson,"The Associated Press projects Rep. Ruben Gallego, D-Ariz., will defeat Trump-backed Kari Lake in the state's Senate race. Rep. Ruben Gallego, D-Ariz., has won the race for Arizona's open Senate seat, beating out Republican Kari Lake, a close ally of President-elect Donald Trump, according to The Associated Press Monday night. This was the final Senate race to be called, leaving the Republicans with a 53-47 majority. It’s still not clear which party will secure a House majority with a handful of races yet to be called there. Gallego has served in the House of Representatives since 2015, representing the 7th and 3rd congressional districts in Arizona.  ARIZONA DEMOCRATIC PARTY OFFICE SHARED WITH HARRIS-WALZ CAMPAIGN SHOT AT FOR THIRD TIME IN LESS THAN A MONTH Kari Lake and Rep. Ruben Gallego competed for the open Senate seat in Arizona. (Reuters) Lake ran unsuccessfully for Arizona governor in 2022 and was defeated by Gov. Katie Hobbs, D-Ariz. Prior to her gubernatorial run, she was a news anchor for a local Arizona television station and worked in the media for 27 years.  After the 2022 loss, she challenged the results, citing fraud concerns in the state. Lake still contends that there were significant irregularities in 2020 and 2022, echoing claims that Trump and many of his supporters have made. The concerns have led to the Republican National Committee devoting significant resources to election integrity efforts.  SWING STATE GOP CHAIR SLAMS BIDEN-HARRIS ADMIN FOR BEING OUT OF TOUCH ON KEY ISSUE: 'ABANDONED THIS COUNTRY' Primaries were held on Tuesday night to fill the seat being vacated at the end of this year by Rep. Ruben Gallego. (Getty Images) Lake faced off against Pinal County Sheriff Mark Lamb in the Republican Senate primary, while Gallego had an advantage, running in the Democratic primary unopposed.  The Fox News Power Rankings in September rated the Arizona Senate race as ""Leans Democrat."" Similarly, the Cook Political Report, a top political handicapper, also considered the race ""Lean Democrat.""  TRUMP-BACKED HOUSE CANDIDATE RIPS BIDEN'S 'JOKE' BORDER POLICY FOR INVITING GANG VIOLENCE TO SWING STATE Sen. Kyrsten Sinema speaks at a committee on Oct. 19, 2021, in Washington, D.C. (Photo by Rod Lamkey-Pool/Getty Images) The Senate seat is currently held by Sen. Kyrsten Sinema, I-Ariz., who was elected as a Democrat. She still caucuses with Democrats in the Senate but officially registered as an independent years ago after opposing her fellow Senate Democrats on the legislative filibuster. Sinema and Sen. Joe Manchin, I-W.Va., are credited with going against the Democrats to uphold the filibuster's 60-vote threshold.  Both senators decided not to run for re-election.  NEXT PRESIDENTIAL ADMINISTRATION HAS TO 'GET SERIOUS' ABOUT IMMIGRATION, SAY VOTERS IN KEY BATTLEGROUND STATE Rep. Ruben Gallego and Kari Lake are battling in the Arizona Senate race. (Getty Images) Before she announced that she was not going to seek another term, Sinema's potential run as a third-party candidate threatened to upend the Senate race, with strategists unsure how her supporters would break.  CLICK HERE TO GET THE FOX NEWS APP In polling leading up to the Senate election, Gallego frequently led Lake by single digits. He had even managed to lead his opponent in surveys that saw Trump defeating Vice President Kamala Harris. Experts speculated that his connection with Latino voters could have fueled split-ticket voting in the state, despite the practice becoming relatively rare.  While Lake often played up her relationship with Trump, who had polled higher than her in the state, Gallego did not often do the same with Harris during his campaign.  Get the latest updates from the 2024 campaign trail, exclusive interviews and more at our Fox News Digital election hub. Julia Johnson is a politics writer for Fox News Digital and Fox Business, leading coverage of the U.S. Senate. She was previously a politics reporter at the Washington Examiner.  Follow Julia's reporting on X at @JuliaaJohnson_ and send tips to Julia.Johnson@fox.com. ",https://www.foxnews.com/politics/dem-rep-ruben-gallego-beats-kari-lake-battle-arizona-senate-seat
